{
  "id": "example",
  "object": "phone_number",
  "phone_number": "+15551234567",
  "reserved_for_second_factor": false,
  "default_second_factor": false,
  "reserved": false,
  "verification": {
    "object": "verification_otp",
    "status": "unverified",
    "strategy": "phone_code",
    "attempts": 0,
    "expire_at": 1747939800,
    "verified_at_client": "example"
  },
  "linked_to": [
    {
      "type": "example",
      "id": "example"
    }
  ],
  "backup_codes": [
    "example"
  ],
  "created_at": 0,
  "updated_at": 0
}